{
  "name": "agent-portal-browser",
  "version": "0.0.2",
  "type": "browser-extension",
  "permissions": [
    "browser:read",
    "browser:control",
    "network:inspect"
  ],
  "commands": [
    "agentPortal.connectRuntime",
    "agentPortal.capturePage",
    "agentPortal.openQueue"
  ],
  "panels": [
    "page-inspector",
    "queue"
  ]
}
