{
  "name": "agent-portal-skills",
  "version": "0.0.2",
  "type": "skill-plugin",
  "permissions": [
    "memory:read",
    "reports:read",
    "runtime:steer"
  ],
  "commands": [
    "skills.react",
    "skills.supabase",
    "skills.stripe",
    "skills.qa"
  ],
  "settings": {
    "autoload": true
  }
}
