{
  "name": "agent-portal-python",
  "version": "0.0.2",
  "type": "python-plugin",
  "permissions": [
    "runtime:connect",
    "reports:read",
    "browser:control"
  ],
  "entryPoint": "python/agent_portal/__init__.py",
  "commands": [
    "portal.launch",
    "portal.open",
    "portal.report"
  ]
}
